{
  "schemaVersion": 1,
  "asOf": "2026-08-11",
  "status": "offline_payload_free_backup_restore_and_disaster_recovery_rehearsal_ready_production_durability_gated",
  "purpose": "Define and adversarially rehearse the payload-free backup, restore, and disaster-recovery boundary required before Mythical can depend on autonomous company operating evidence after coordinator, storage, or failure-domain loss. The control binds current A-042 packet, A-046 history, A-047 exception, A-048 lease, A-049 recovery, and A-050 consensus evidence into an exact digest-only manifest; writes, copies, reads back, and restores that manifest in separate operating-system temporary failure-domain directories; detects corruption, truncation, deletion, reordering, stale generations, and unauthorized domains; admits exactly one of four simultaneous restore claimants; blocks activation when global disable is present; and invokes no scheduled company workflow, retains no raw payload or credential, grants no cycle credit, and configures no production backup, restore, durability, or disaster-recovery service.",
  "decisionRefs": ["D-014", "D-017"],
  "riskRefs": ["R-011", "R-013"],
  "workflowRefs": ["A-012", "A-023", "A-030", "A-031", "A-035", "A-041", "A-042", "A-046", "A-047", "A-048", "A-049", "A-050", "A-051"],
  "authority": {
    "productionBackupAuthorized": false,
    "productionRestoreAuthorized": false,
    "productionDisasterRecoveryAuthorized": false,
    "productionRecordWriteAuthorized": false,
    "schedulerActivationAuthorized": false,
    "triggerActivationAuthorized": false,
    "packetAdmissionAuthorized": false,
    "packetExecutionAuthorized": false,
    "credentialUseAuthorized": false,
    "networkAccessAuthorized": false,
    "repositoryWriteAuthorized": false,
    "automatedDispatchAuthorized": false,
    "spendAuthorized": false,
    "externalActionAuthorized": false,
    "conversationIsAuthorization": false
  },
  "sourceEvidence": {
    "packetWorkflowId": "A-042",
    "historyWorkflowId": "A-046",
    "alertWorkflowId": "A-047",
    "leaseWorkflowId": "A-048",
    "recoveryWorkflowId": "A-049",
    "consensusWorkflowId": "A-050",
    "packetSourceIds": ["OC-001", "OC-002"],
    "livePacketIdsAndDigestsRequired": true,
    "currentHistoryEvidenceDigestRequired": true,
    "currentAlertEvidenceDigestRequired": true,
    "currentLeaseEvidenceDigestRequired": true,
    "currentRecoveryEvidenceDigestRequired": true,
    "currentConsensusEvidenceDigestRequired": true,
    "rawEvidencePayloadPermitted": false,
    "scheduledCompanyWorkflowInvocationPermitted": false
  },
  "backupPolicy": {
    "manifestSchemaVersion": 1,
    "digestAlgorithm": "sha256",
    "currentGeneration": 2,
    "evidenceRecordCount": 6,
    "sourceFailureDomain": "fd-primary",
    "approvedRestoreFailureDomain": "fd-standby",
    "maximumConcurrentRestoreHolderCount": 1,
    "restoreContenderCount": 4,
    "maximumLocalRestoreMilliseconds": 3000,
    "fullReadBackRequired": true,
    "exactRecordOrderRequired": true,
    "staleGenerationRestorePermitted": false,
    "crossDomainRestoreWithoutApprovalPermitted": false,
    "rawPayloadIncluded": false,
    "credentialMaterialIncluded": false,
    "externalActionAuthorized": false,
    "sensitivePayloadIncluded": false,
    "manifestFields": ["schemaVersion", "backupId", "generation", "createdAt", "sourceFailureDomain", "targetFailureDomain", "recordCount", "records", "manifestDigestSha256", "externalActionAuthorized", "sensitivePayloadIncluded"],
    "recordFields": ["sequence", "workflowId", "evidenceDigestSha256", "state", "rawPayloadIncluded", "credentialMaterialIncluded"]
  },
  "scenarioPlan": {
    "scenarioCount": 10,
    "scenarios": [
      { "sequence": 1, "id": "BR-001", "fault": "write_payload_free_backup", "expectedOutcome": "backup_written_and_read_back" },
      { "sequence": 2, "id": "BR-002", "fault": "restore_exact_manifest_to_standby", "expectedOutcome": "restore_digest_and_records_match" },
      { "sequence": 3, "id": "BR-003", "fault": "corrupt_backup_digest", "expectedOutcome": "corruption_detected" },
      { "sequence": 4, "id": "BR-004", "fault": "truncate_backup_file", "expectedOutcome": "truncation_detected" },
      { "sequence": 5, "id": "BR-005", "fault": "delete_evidence_record", "expectedOutcome": "record_deletion_detected" },
      { "sequence": 6, "id": "BR-006", "fault": "reorder_evidence_records", "expectedOutcome": "record_reorder_detected" },
      { "sequence": 7, "id": "BR-007", "fault": "restore_stale_generation", "expectedOutcome": "stale_generation_refused" },
      { "sequence": 8, "id": "BR-008", "fault": "restore_to_unapproved_failure_domain", "expectedOutcome": "failure_domain_refused" },
      { "sequence": 9, "id": "BR-009", "fault": "four_simultaneous_restore_claimants", "expectedOutcome": "exactly_one_restore_winner" },
      { "sequence": 10, "id": "BR-010", "fault": "global_disable_before_restored_activation", "expectedOutcome": "restored_activation_refused" }
    ],
    "expectedPassedScenarioCount": 10,
    "expectedBackupWriteCount": 1,
    "expectedExactRestoreCount": 1,
    "expectedCorruptionDetectionCount": 1,
    "expectedTruncationDetectionCount": 1,
    "expectedDeletionDetectionCount": 1,
    "expectedReorderDetectionCount": 1,
    "expectedStaleGenerationRefusalCount": 1,
    "expectedFailureDomainRefusalCount": 1,
    "expectedRestoreWinnerCount": 1,
    "expectedRestoreLoserCount": 3,
    "expectedGlobalDisableActivationBlockCount": 1
  },
  "refusalPlan": {
    "scenarioCount": 17,
    "expectedRefusalCount": 17,
    "scenarios": [
      { "id": "DR-001", "mutation": "substitute_packet_evidence", "expectedReasonCode": "source_evidence_mismatch" },
      { "id": "DR-002", "mutation": "substitute_history_evidence", "expectedReasonCode": "source_evidence_mismatch" },
      { "id": "DR-003", "mutation": "substitute_alert_evidence", "expectedReasonCode": "source_evidence_mismatch" },
      { "id": "DR-004", "mutation": "substitute_lease_evidence", "expectedReasonCode": "source_evidence_mismatch" },
      { "id": "DR-005", "mutation": "substitute_recovery_evidence", "expectedReasonCode": "source_evidence_mismatch" },
      { "id": "DR-006", "mutation": "substitute_consensus_evidence", "expectedReasonCode": "source_evidence_mismatch" },
      { "id": "DR-007", "mutation": "invalid_generation", "expectedReasonCode": "generation_invalid" },
      { "id": "DR-008", "mutation": "stale_generation", "expectedReasonCode": "generation_stale" },
      { "id": "DR-009", "mutation": "invalid_created_time", "expectedReasonCode": "created_time_invalid" },
      { "id": "DR-010", "mutation": "unapproved_source_failure_domain", "expectedReasonCode": "failure_domain_invalid" },
      { "id": "DR-011", "mutation": "unapproved_target_failure_domain", "expectedReasonCode": "failure_domain_invalid" },
      { "id": "DR-012", "mutation": "remove_required_field", "expectedReasonCode": "manifest_fields_invalid" },
      { "id": "DR-013", "mutation": "add_payload_field", "expectedReasonCode": "manifest_fields_invalid" },
      { "id": "DR-014", "mutation": "include_raw_payload", "expectedReasonCode": "payload_or_credential_material_invalid" },
      { "id": "DR-015", "mutation": "include_credential_material", "expectedReasonCode": "payload_or_credential_material_invalid" },
      { "id": "DR-016", "mutation": "authorize_external_action", "expectedReasonCode": "authority_or_payload_flag_invalid" },
      { "id": "DR-017", "mutation": "global_disable_active", "expectedReasonCode": "global_disable_active" }
    ]
  },
  "rehearsalStore": {
    "kind": "operating_system_temporary_separated_primary_backup_restore_and_quarantine_directories",
    "outsideRepositoryRequired": true,
    "directoryMode": "0700",
    "recordMode": "0600",
    "exclusiveCreateRequired": true,
    "separateFailureDomainDirectoriesRequired": true,
    "recordsRemovedAfterRun": true,
    "countsAsProductionBackup": false,
    "countsAsEligibleCycle": false,
    "productionDurabilityConfigured": false
  },
  "productionDurabilityPolicy": {
    "providerSelected": false,
    "backupStoreRef": null,
    "restoreStoreRef": null,
    "sourceRegionRef": null,
    "recoveryRegionRef": null,
    "writerIdentityConfigured": false,
    "readerIdentityConfigured": false,
    "restoreIdentityConfigured": false,
    "encryptionKeyConfigured": false,
    "retentionPolicyApproved": false,
    "immutabilityVerified": false,
    "independentFailureDomainVerified": false,
    "restoreIntegrityVerified": false,
    "recoveryPointObjectiveApproved": false,
    "recoveryTimeObjectiveApproved": false,
    "regionalFailoverVerified": false,
    "productionRestoreExercisePassed": false,
    "authenticatedAlertRouteConfigured": false
  },
  "activationGates": [
    { "id": "BR-G01", "gate": "D-017 records the operating cell, backup owner, restore operator, backup, urgent recipient, recovery operator, kill operator, and selected runtime and durability classes", "satisfied": false },
    { "id": "BR-G02", "gate": "The provider, account, primary and recovery regions, failure domains, storage classes, service objectives, support boundary, and exact all-in cost are selected and approved", "satisfied": false },
    { "id": "BR-G03", "gate": "Separated least-privilege writer, reader, backup, restore, recovery, kill, alert, key-management, and independent assurance identities are attested and revocable", "satisfied": false },
    { "id": "BR-G04", "gate": "The exact payload-free backup manifest, source evidence, generation, digest, ordering, completion, retention, immutability, and deletion semantics are approved", "satisfied": false },
    { "id": "BR-G05", "gate": "Backups are encrypted with approved key ownership, rotation, recovery, revocation, escrow, access logging, and separation from the backed-up storage boundary", "satisfied": false },